During the siege , George Robertson had appointed Shuja-ul-Mulk , who was a bright boy only 12 years old and the youngest surviving son of Aman-ul-Mulk , as the ruler of Chitral .;bright;76;82
The actual field is not much different than that of a 40mm , only it is smaller and quite a bit noticeably brighter , which is probably the main benefit .;brighter;107;115
The roses have grown out of control , wild and carefree , their bright blooming faces turned to bathe in the early autumn sun .;bright;64;70
He was bright and independent and proud .;bright;7;13
In fact , during at least six distinct periods in Army history since World War I , lack of trust and confidence in senior leaders caused the so-called best and brightest to leave the Army in droves .;brightest;160;169
An evening of classical symphonic music , played by the next generation stars in the American orchestral scene , can be savored at the New World Symphony , a special Miami institution that nurtures the best and brightest young symphonic musicians .;brightest;211;220
There are sound reasons for concluding that the long-run picture remains bright , and even recent signals about the current course of the economy have turned from unremittingly negative through the late fall of last year to a far more mixed set of signals recently .;bright;73;79
Snow covered areas appear bright blue in the image which was taken in early spring and shows deep snow cover .;bright;26;32
She turns eyes bright with excitement towards Fiona , still tugging on the string of the minitiature airship-cum-dance card she has just received at the door .;bright;15;21
A short excerpt : I was praying in private until someone got the bright idea of starting a Presidential Prayer Team .;bright;65;71
So , unlike studio films , independent films cannot be conceptually geared to a marketing campaign , or used to recruit merchandising tie-ins .;films;39;44
The packed screening of about 100 high-level press people loved the film as well .;film;68;72
I think most filmmakers for the most part right now they\xe2\x80\x99re thinking about the DVD when they go in to production because the reality is DVD is where the great majority of your audience is going to experience the film .;film;223;227
Dune makes the second Lynch film to be released in a consumer HD format ( Mulholland Drive on D-VHS being the first ) .;film;28;32
Film Music Literature Cyberplace - Includes film reviews , message boards , chat room , and images from various films .;film;44;48
His feature film debut HEROES / DE ST\xc3\x83\xc2\x98RSTE HELTE ( 1996 ) won awards at Rouen and Madrid .;film;12;16
( Some people keep their TVs on for company. ) In Malta , news is the main reason we turn to TV , followed by films , talk shows , documentaries , serials , and music , in that order .;films;110;115
The film shows Afghan mercenaries to be involved with the separatists , suggesting that the present struggle in Kashmir has been hijacked by foreign extremists , who are shown discussing the loss of Bangladesh in the 1971 war , providing it as a justification for their present acts of revenge .;film;4;8
A fine score by George Fenton ( THE CRUCIBLE ) and beautiful photograhy by Roger Pratt add greatly to the effectiveness of the film .;film;127;131
The success of Autry \' s early films was not enough to save Mascot Pictures , which collapsed under the weight of debts held by Consolidated Film Laboratories , which did Mascot \'s film processing .;films;32;37
That \'s not to say the process of actual negotiating is n\'t taking place .;taking;62;68
""" Hugh Grant and Alan Rickman , as Edward and Col. Brandon respectively , took the most chances and the various reviewers therefore either love or hate their performances .";took;74;78
It should n\'t take that long .;take;15;19
It only affects the start up time of a program , and for a process that takes several months ( his code was computing the 196 Palindrome Quest ) , it does not matter if the initialization code takes 1/1,000th of a second or 1/10,000th of a second .;takes;193;198
If we take the factual context in which the term is used into consideration , then its extension becomes limited , owing to the context .;take;6;10
If you do n\'t take the risk of dying by driving to the store , your house could collapse on you and kill you anyway .;take;15;19
The Governor took the big sheets of imitation parchment , glanced over them , signed his name to each , laid down the pen , and handed the papers across the table to Dreier .;took;13;17
O\'Neill and the two men who worked under his supervision maintained the avenue , raking the thin gravel and removing any weed that tried to take root in the stony earth .;take;141;145
Even if the Anglo-French Summit did not take place until next year , the Prime Minister and President Chirac were still due to see each other in November and December .;take;40;44
40 Day-to-day financial and operational management is the responsibility of the Chief Officer , who took up her post in June 2001 .;took;100;104
Anyway , my pants are getting tight .;tight;30;35
With the physical market has tight as it has been in memory , silver could fly at any time .;tight;29;34
More ... Specialty coffee market quiet , supplies tight Posted at 2:57 PM by Robert Badgett By Bruce Kamich NEW YORK , June 6 ( Reuters ) - Specialty coffee dealers said on Friday that business was unusually quiet with most retailers \' sales numbers down from a year ago , but prices for choice beans remained firm with supplies short until the next crops become available .;tight;50;55
If your money is tight do n\'t cut corners .;tight;17;22
Each child lies inside an Isolette incubator , a clear acrylic rectangle with ample room for a half-sized premature baby , though the quarters become tight for the full-term eight-pounders .;tight;150;155
""" It can be intimidating at first , because they wrap their arms pretty tight around you , and everything they latch onto is pretty much headed straight to their mouth , "" Schmitz said .";tight;72;77
The incisions will feel tight for the first 24-48 hours .;tight;24;29
Except for the soldiers , Goth was locked up tight .;tight;45;50
Nathan Robins : Did well to keep tight on the Left winger and was harshly judged by the referee on several occasions to have fouled the opposing player when I felt he just out muscled him .;tight;33;38
I know that the market is tight right now .;tight;26;31
That \'s not a very high bar .;bar;25;28
This more upright position is most easily and affordably achieved through slapping a riser bar on your setup , and only requires you to buy a bar instead of a bar and stem .;bar;159;162
For twelve hours Livewire will be broadcasting live from the blue bar of Union House at UEA in an attempt to raise as much money as possible for a very worthy cause .;bar;66;69
The British government imposed a colour bar in its colonies , so young blacks went in only for law or medicine where they could make a living without government support .;bar;40;43
Put granola bars in bowl .;bars;12;16
It \'s been a criticism of IE \'s scrollbar CSS and also stands for the status bar .;bar;79;82
2 ) Straddling the center bar , your child should be able to keep both feet flat on the ground with about a 1-inch clearance between the crotch and the bar .;bar;152;155
Seventy-five percent of my clientele that comes in there , they are just like a person on a Friday afternoon going into a bar , and he sits at the counter , and the bartender knows what he wants to drink .;bar;122;125
The night is long at the numerous other discos and clubs , but for those seeking something more sedate there are quieter , sophisticated bars in the hotels .;bars;137;141
Abstract : Analysis of contact between two chromosomal races of house mice in northern Italy show that natural selection will produce alleles that bar interracial matings if the resulting offspring are unfit hybrids .;bar;147;150
When Time magazine \'s cover portrays millennium nuts as deranged , crazy Christians holding a cross as it did last month , boycott their magazine and the products it advertises .;cross;95;100
Four-Set in a cross , the points meeting in water surrounded by luminous crescents .;cross;14;19
It was designed in the form of a cross with a cast iron sword placed where the cross members join .;cross;79;84
Triticale , a cross between wheat and rye , matures later than rye but earlier than wheat .;cross;14;19
Old Nick got tired of cussing , was humiliated at being sat on , and hurting like the torments of Hell for being so close to the cross .;cross;129;134
By 1924 he managed to transmit across a few feet the flickering image of a Maltese cross and on 26th January 1926 he gave the world \'s first demonstration of true television in his attic workshop before some fifty scientists .;cross;83;88
He appeared to his apostles and spoke to them about God \'s kingdom. \' Acts 1:3 Jesus took the consequences of our self-centredness by giving up his life on the cross .;cross;162;167
"If power cycling occurs , care must be taken to account for the "" dead time "" between shutdown and power up when the latchup cross section is evaluated .";cross;125;130
""" Mixed race people represent a diverse cross section of racial , ethnic , and cultural heritages , with many multiracial individuals identifying with multiple communities , "" the organizations stated .";cross;40;45
I can only judge keyboards by going into somewhere like PC World and physically trying them , and I do not want to go into somewhere like PC World , as I do not want to get cross .;cross;173;178
Mr. Hall \'s old factory is still on Oklahoma Avenue , but the metal fabrication plant where Mr. Larson worked finally closed last year after withering for decades .;finally;111;118
Finally , this new rule will also have the effect of encouraging existing corporations to produce safer products , in keeping with the public policy goals that underlie product liability law generally. [ Fn .;Finally;0;7
However , this easy clearing method has muddled the issue quite a bit , since now Explorer is not actually being cleared at all , while Gecko browsers have finally been corrected so they do clear all previous floats .;finally;156;163
Finally , Adam sees the ID card being used as an authenticator because it might be declared trustworthy .;Finally;0;7
"He said , "" OK , first , I \'d like to have a face like Clark Gable , then , I \'d like a build like Arnold Schwarzenegger , and finally , I \'d like sexual equipment like this here horse I \'m riding .";finally;129;136
Finally , I interviewed Eric Howes , a noted spyware researcher at the University of Illinois , who has found that today \'s most popular anti-spyware software packages are far less effective than many believe ( see sidebar , below ) .;Finally;0;7
However , you will get those NSF fees reimbursed by the bank as well - it will just come when they finally process everything together .;finally;99;106
Finally , the Army has conducted range characterization activities regarding the potential for contamination from munitions residues at 17 ranges throughout the United States , assessing the different types of ranges used by the Army .;Finally;0;7
Finally , it is outlined how a mesoscopic theory should be constructed for a particular scanning tunneling microscopy experiment in order to overcome the failure of a corresponding reaction\xc2\x96diffusion model to quantitatively reproduce the experiments .;Finally;0;7
Finally , the proposed disposal rule would apply to transfer agents registered with the Commission .;Finally;0;7
Up to sixty percent of the fatty acid content in the grasses on the plains contain omega-3 and are found in abundance in buffalo allowed to graze on the natural grasses .;found;99;104
If you find yourself caught up in negative thoughts and find that you suddenly expect the worst it will be impossible to perform at your peak .;find;56;60
Search Customer Reviews 9 of 10 people found the following review helpful : Early feminist literature - memorable , November 21 , 2000 Reviewer : M. J. Smith ( Seattle , WA USA ) - See all my reviews This book consists of a gem of a story and a mediocre afterward .;found;39;44
Well they have a friend named Morgan and Morgan told them to find an object that he wants .;find;61;65
Consistent with previous findings , lack of congruence was found to be a precursor of intrusiveness .;found;59;64
nokia mobile phone cases , motorola cell phone cases , motorola cell phone case , body glove cell phone case I think the best place where you can find CELL PHONE CARRYING CASE is eBay .;find;146;150
Oh , and as far as the Kool-Aid jokes , find your own material .;find;40;44
But much that we once accepted as inevitable , we now find absolutely intolerable .;find;54;58
SpeedUpMyPC automatically finds the best settings for your PC and carefully controls your system resources to give you the best performance .;finds;26;31
If Bessler had indeed discovered some mechanical way of creating perpetual motion , perhaps the only way it is explainable is if he had found a way of extracting the energy from this Aether .;found;136;141
"The Transcendental Meditation people advertised this : "" Meditation can fix many sicknesses .";fix;72;75
Now , I \'m not sure how I went from missing two weeks to six , but intend to fix that as I go .;fix;78;81
\' \' I feel I can get a lot more done as a selectman by being innovative and fixing the problems we have with cash flows , because they occur every year .;fixing;78;84
Getting back to the day when doctors looked at the whole person .and did not expect a pill to fix the mind .;fix;94;97
And thanks to our users , we now have around 30 engines in the database ... New features : - Better layout - Better copy - Small bugs fixed Bugs : - ie hell + much more Posted by eric at 05:24 PM | Comments ( 3 ) Investment News As part of the new international expansion strategy 24hdc.com now accepts USD for investments .;fixed;134;139
Er , tilty. by anna at July 17 , 2003 03:37 PM yeah , in our case , whoever did the foundation fucked up royally. when the house settled , it was fubar. should be pretty easy to fix though...just a matter of getting the pilings set to the right heights. by JC at July 17 , 2003 06:32 PM add a comment Name : Email Address : URL : Remember personal info ?;fix;178;181
I guess I \'ll be able to hit the hot button many times as I \'m always at the dealer getting my car fixed .;fixed;101;106
The long-term problem with Social Security after 2042 could be totally fixed by raising the cap on income to a level needed to generate sufficient income to enable the system to continue to pay 100 percent indefinitely .;fixed;71;76
"The only way to fix this is for linux to get enough market share to be able to make demands for hardware support. [ reply ] [ top ] [ \xc3\x82 \xc2\xbb ] Releasing specs is the only answer. by The Nose Who Knows - Feb 26th 2001 04:29:40 &gt; The other reason why vendors do n\'t support linux &gt; most of the time for commidity hardware such as &gt; webcam is low returns on investments .";fix;16;19
But if no prayers can alter your purpose , dear one , husband , if you are so fixed on going , take me with you , also !;fixed;78;83
"Suddenly there was a scattering of fire , which three outfielders caught the brunt ; the centerfield was hit and was captured , left and right field managed to get back to our lines .";managed;149;156
""" C158 ( cf ex R145 ) "" The Provincial in Councilor the Superior ofthe Delegation in Councilsets the financial competency of local Superiorsand their Councilsand determines which assets can be managed by individualOblates and by local Superiors and their Councils .";managed;193;200
BUSINESS DEVELOPMENT MANAGER STRATEGIC ALLIANCES This individual will be responsible for coordinating , negotiating , launching , and managing Accuity \'s partner relationships .;managing;134;142
A married woman retains ownership of any property she brought to the marriage , but the husband has the right to manage the property and to enjoy profits from the property .;manage;113;119
We do not need to ask for your specific permission to do these things , as explained below : Treatment Partners health care providers will use and share your health information to provide and manage your health care and related services .;manage;192;198
"According to a White House press release , al-Taqwa and its affiliates "" raise , manage , invest , and distribute funds for al-Qaeda ; provide terrorist supporters with internet service and secure telephone communications ; and arrange for the shipment of weapons .";manage;81;87
That is , if the average person ( say this is 98 % of people ) amasses 10 things , if I manage to acquire 20 things then perhaps my account is not worth twice as much but maybe 10x or 100x as much as average .;manage;88;94
There are different types of managed care systems .;managed;29;36
Saddam Hussein did n\'t manage to defeat the Iranians .;manage;24;30
The M107 program is managed by the Project Manager Soldier Weapons with engineering support provided by Picatinny\xc3\x82\xc2\x92s Armament Research , Development and Engineering Center .;managed;20;27
It is really a neat plan , well documented and a model for libraries that are still working on their plans. ~ ~ ~ Corrections to April 2003 issue of LDD On the Road : Some things slipped by when putting together last month\xe2\x80\x99s issue of LDD On the Road .;neat;15;19
And the prize for neatest , simplest idea has to go to britkid.org , a resource for opening children \'s eyes to the diversity of our culture. www.skoool.com www.nrich.maths.org.uk www.stagework.org.uk www.learningcurve.gov.uk www.britkid.org Email Hotmail is the free email service everyone knows .;neatest;18;25
Over the course of the 20th century scholars have learned that such images tried to make messy reality neater than it really is .;neater;103;109
Strong field patterns created by hedgerows give the landscape a neat , well structured appearance .;neat;64;68
Besides a list of specific things you wish they would talk about , the following things are helpful additions to the neat packet you hand them when you ask them to write the letter .;neat;117;121
""" -4 Time IROC Champion Mark Martin Indy 500 , CART and IROC champion , Al Unser Jr. said , "" I watched my father and uncle Bobby race in IROC and as a kid I thought it would be really neat if someday I would get an opportunity to run IROC .";neat;185;189
The Society for Academic Emergency Medicine is a neat little bunch of people who are dedicated to furthering the interests of academia and research in the youngest of the medical specialties .;neat;49;53
A weblog by Tom Coates who thinks up neat stuff for Yahoo !;neat;37;41
But not as odd as the 35 others who bedded down with him each night in a neat row down the street on a carpet of cardboard boxes and multicoloured raffia beach mats .;neat;73;77
Link to the full FEDERAL GOVERNMENT DEBT REPORT with pictures - there are 9 color graphics that tell the whole story - - so , give the next page time to load those neat pictures .;neat;164;168
What are the important variables that create a rich online learning experience , one that makes real improvements in academic practice ?;rich;47;51
Trees on Anmyeondo used to be thick and lush to the extent of prompting a saying , \xc3\x82\xc2\xa1\xc3\x82\xc2\xb0You can become rich with an axe.\xc3\x82\xc2\xa1\xc3\x82\xc2\xb1 But now only few trees are left due to reckless deforestation since the time of Korea\xc3\x82\xc2\xa1\xc3\x82\xc2\xafs liberation from Japanese colonial rule .;rich;130;134
No , we \'re not talking about the fortunes of a rich and powerful democracy .;rich;49;53
Functional Foods and Drinks , Sports Drinks , Slimming , Supplements Functional foods : Glico launches this chocolate rich in GABA for its relaxing effect .;rich;118;122
Africas central problems in the WTO revolve around the imbalances and biases created by rich countries in the Uruguay Round Agreement ( URA ) .;rich;88;92
Today half the world \'s population lives on less than $ 2 a day , 80 percent of the global population has only 20 percent of global GDP , and within each country there is a massive imbalance between rich and poor .;rich;200;204
"Here Wagner , in depicting every shade of sexual love , developed a style richer and more chromatic than anyone had previously attempted , using dissonance and its urge for resolution in a continuing pattem to build up tension and a sense of profound yearning ; Act 2 is virtually a continuous love duet , touching every emotion from the tenderest to the most passionately erotic .";richer;74;80
He brings an incredibly rich and diverse background that includes everything from executive coaching , learning & development and management consulting , to senior operations roles , mixed with a masters in organizational development .;rich;24;28
Rich people manage their money well .;Rich;0;4
"I also think that it will probably take the "" sword "" of nations ( ala Rom 13 ) combined with the good news offered by the body of Christ to touch the hearts and change the ways of the "" rich Africans "" ( and rich Americans and other westerners , frankly ) to bring change .";rich;209;213
Rubinstein held the gambit pawn with 4.Bf4 and 7.Qd5 , but his neglect of kingside development was severely punished .;severely;99;107
This veteran , the oldest pensioner in Great Britain , entered the army in 1758 , and was severely wounded at the battle of Quebec under General Wolfe , in consequence of which he became an out-pensioner of Chelsea Hospital , and continued so for the period of seventy-five years .;severely;90;98
Perhaps the effect of West Nile Virus is sufficient to extinguish endemic birds already severely stressed by habitat losses .;severely;88;96
She looked as severely as she could muster at Draco .;severely;14;22
A day before he was due to return to the United States Patton was severely injured in a road accident .;severely;66;74
Use market tools to address environmental issues , such as eliminating subsidies for industries that severely harm the environment , like coal .;severely;101;109
This picture was severely damaged in the flood of 1913 and has rarely been seen until now .;severely;17;25
I was very disappointed when the author did not go into detail about how he regained his faith after having it severely undermined by his early studies in theology at university .;severely;111;119
We do continue to support research on the differentiation of adult precursor cells into beta cells , but that \'s a severely limited field in terms of how successful it has been .;severely;116;124
Mutual Funds are so severely conflicted that they will not avail themselves of the alleged benefits of the proposed rule .;severely;20;28
Leaders of some of the most powerful states in the world stand by and give the impression that this is just the new way of life for Zimbabweans .;stand;57;62
We cannot stand as helpless spectators while millions die for want in a world of plenty .;stand;10;15
She knew that behind this remarkable new event that had overwhelmed Allah\xc3\x82\xc2\x92s Messenger ( sallallahu \xc3\x82\xc2\x91alayhi wa sallam ) lay something great that Allah ( Subhanahu wa ta\xc3\x82\xc2\x92ala ) had prepared for His Messenger , so she spoke her kind and sweet words of encouragement , filling him with confidence , tranquility and firm conviction : \xc3\x82\xc2\x93Be of good cheer , O cousin , and stand firm .;stand;423;428
Liberals(135)+NDP(19)=154=the usual yapping NDP of no consequence Liberals(135)+Bloc(54)=189=oui the government stands or non it falls Do n\'t count on the Bloc to squander their good fortune like they did the last time they had 54 either .;stands;112;118
1 MCAS stands for the Massachusetts Comprehensive Assessment System , a standards test administered to students in grades 3 , 4 , 5 , 6 , 7 , 8 , and 10 throughout the state .;stands;7;13
And secondly , the Consensus demonstrated to the World that Africa no longer stands on the fridges or sit on the fence when issues likely to have impacts on its economies and its people are being discussed .;stands;77;83
Sapling and Pole Stages to Maturity Growth and Yield- Mature northern red oaks are usually from 20 to 30 m ( 65 to 98 ft ) tall and 61 to 91 cm ( 24 to 36 in ) in d.b.h. in undisturbed stands on good sites .;stands;185;191
The stand is not included .;stand;4;9
Here , its walnut case has been mounted on an adjustable stand to make one of the earliest desk sets .;stand;57;62
The denomination essentially voted to take a neutral stand on many varying interpretations of Genesis 1. Feedback Letter >From : Stephen Craig Comment : First , let me compliment all of you for a great site .;stand;53;58
Attorney General \'s Page The Connecticut Attorney General \'s website includes a discussion of current health topics , including HMOs , Medicare , current Connecticut health legislation , and insurance issues as well as information on your rights when it comes to making health care decisions .;well;213;217
We needed to plan well in advanced to give schools enough warning but not too much choice on times and dates as this seemed to make decisions harder !;well;18;22
And be ready to move elsewhere if you are not being treated well .;well;60;64
Treatment of physical problems , particularly chronic ones , is possible as well as psychological therapy .;well;76;80
"Fades the light ; And afar Goeth day , And the stars Shineth bright , Fare thee well ; Day has gone , Night is on .";well;80;84
Half the phones , half the computers , half the consumer electronic products we buy are not as well made or designed as the other half .;well;95;99
Well , perhaps not .;Well;0;4
